{
  "schema_version": "1.3.3",
  "run_id": "UIUX-20261023-001",
  "source_fingerprint": {
    "kind": "git_commit",
    "value": "aaaaaaaaaaaaaaaaaaaaaaaaaaaaaaaaaaaaaaaa",
    "algorithm": "git-sha1"
  },
  "records": [
    {
      "task_id": "import",
      "scenario_id": "native-import",
      "required_runtime_level": "NATIVE_APP",
      "observed_runtime_level": "NATIVE_APP",
      "test_state": "PASS",
      "review_isolation_level": "SELFTEST",
      "probe_id": "P-G5",
      "evidence_refs": [
        "EV-G5"
      ],
      "execution_environment": {
        "host": "dsh",
        "os": "Windows 11",
        "session_kind": "shared_desktop"
      },
      "source_fingerprint": {
        "kind": "git_commit",
        "value": "aaaaaaaaaaaaaaaaaaaaaaaaaaaaaaaaaaaaaaaa",
        "algorithm": "git-sha1"
      }
    },
    {
      "task_id": "export",
      "scenario_id": "native-export",
      "required_runtime_level": "NATIVE_APP",
      "observed_runtime_level": "NATIVE_APP",
      "test_state": "PASS",
      "review_isolation_level": "SELFTEST",
      "probe_id": "P-G5",
      "evidence_refs": [
        "EV-G5"
      ],
      "execution_environment": {
        "host": "dsh",
        "os": "Windows 11",
        "session_kind": "shared_desktop"
      },
      "source_fingerprint": {
        "kind": "git_commit",
        "value": "aaaaaaaaaaaaaaaaaaaaaaaaaaaaaaaaaaaaaaaa",
        "algorithm": "git-sha1"
      }
    }
  ],
  "created_at": "2026-10-23T12:00:00+00:00"
}
