{
  "schema_version": "1.3.3",
  "run_id": "UIUX-20261024-RC3",
  "source_fingerprint": {
    "kind": "dir_digest",
    "value": "218d34af3d0be3ec1fd78badcf3232d9f414b0b4a4f564183ce5f3d52098c531",
    "algorithm": "sha256-tree"
  },
  "records": [
    {
      "task_id": "import",
      "scenario_id": "native-import",
      "required_runtime_level": "NATIVE_APP",
      "observed_runtime_level": "NATIVE_APP",
      "test_state": "PASS",
      "review_isolation_level": "SELFTEST",
      "probe_id": "P-G5",
      "evidence_refs": [
        "EV-G5"
      ],
      "execution_environment": {
        "host": "dsh",
        "os": "Windows 11",
        "session_kind": "shared_desktop"
      },
      "source_fingerprint": {
        "kind": "dir_digest",
        "value": "218d34af3d0be3ec1fd78badcf3232d9f414b0b4a4f564183ce5f3d52098c531",
        "algorithm": "sha256-tree"
      }
    },
    {
      "task_id": "browse",
      "scenario_id": "native-browse",
      "required_runtime_level": "NATIVE_APP",
      "observed_runtime_level": "NATIVE_APP",
      "test_state": "PASS",
      "review_isolation_level": "SELFTEST",
      "probe_id": "P-G1",
      "evidence_refs": [
        "EV-G1"
      ],
      "execution_environment": {
        "host": "dsh",
        "os": "Windows 11",
        "session_kind": "shared_desktop"
      },
      "source_fingerprint": {
        "kind": "dir_digest",
        "value": "218d34af3d0be3ec1fd78badcf3232d9f414b0b4a4f564183ce5f3d52098c531",
        "algorithm": "sha256-tree"
      }
    },
    {
      "task_id": "reader",
      "scenario_id": "native-reader",
      "required_runtime_level": "NATIVE_APP",
      "observed_runtime_level": "NATIVE_APP",
      "test_state": "PASS",
      "review_isolation_level": "SELFTEST",
      "probe_id": "P-G5",
      "evidence_refs": [
        "EV-G5"
      ],
      "execution_environment": {
        "host": "dsh",
        "os": "Windows 11",
        "session_kind": "shared_desktop"
      },
      "source_fingerprint": {
        "kind": "dir_digest",
        "value": "218d34af3d0be3ec1fd78badcf3232d9f414b0b4a4f564183ce5f3d52098c531",
        "algorithm": "sha256-tree"
      }
    },
    {
      "task_id": "export",
      "scenario_id": "native-export",
      "required_runtime_level": "NATIVE_APP",
      "observed_runtime_level": "NATIVE_APP",
      "test_state": "PASS",
      "review_isolation_level": "SELFTEST",
      "probe_id": "P-G5",
      "evidence_refs": [
        "EV-G5"
      ],
      "execution_environment": {
        "host": "dsh",
        "os": "Windows 11",
        "session_kind": "shared_desktop"
      },
      "source_fingerprint": {
        "kind": "dir_digest",
        "value": "218d34af3d0be3ec1fd78badcf3232d9f414b0b4a4f564183ce5f3d52098c531",
        "algorithm": "sha256-tree"
      }
    },
    {
      "task_id": "undo",
      "scenario_id": "native-undo",
      "required_runtime_level": "NATIVE_APP",
      "observed_runtime_level": "NATIVE_APP",
      "test_state": "PASS",
      "review_isolation_level": "SELFTEST",
      "probe_id": "P-U1",
      "evidence_refs": [
        "EV-U1"
      ],
      "execution_environment": {
        "host": "dsh",
        "os": "Windows 11",
        "session_kind": "shared_desktop"
      },
      "source_fingerprint": {
        "kind": "dir_digest",
        "value": "218d34af3d0be3ec1fd78badcf3232d9f414b0b4a4f564183ce5f3d52098c531",
        "algorithm": "sha256-tree"
      }
    }
  ],
  "created_at": "2026-10-24T00:20:44.088248+00:00"
}
